,desc,InitialInterestRate,InitialInterestRate,InitialInterestRate
987,Tour Operators,7.220212355212356,1.8432863865369624,259
907,Software Publishers,7.221530734632684,1.741194404750672,667
135,Business Associations,7.235166666666668,1.7325532169943625,60
1005,Used Car Dealers,7.237970521541947,1.9469527347858169,2205
959,Taxi Service,7.238969230769228,2.0422516771031374,325
568,New Multifamily Housing Construction (except For-Sale Builders),7.2517999999999985,1.6145461049220906,310
728,Painting and Wall Covering Contractors,7.254239111498248,1.8045735109184131,2296
533,Mobile Food Services,7.256571752265845,1.755552276221183,1324
9,Administrative Management and General Management Consulting Services,7.275925978145958,1.79488173511178,2837
446,Internet Publishing and Broadcasting and Web Search Portals,7.281297619047618,1.614702220352789,336
80,Appliance Repair and Maintenance,7.284941326530609,1.703546291832314,392
560,Nail Salons,7.297487394957974,1.7516250990129452,1904
538,Motion Picture and Video Production,7.304659400544953,1.7970298604478148,1101
569,New Single-Family Housing Construction (except For-Sale Builders),7.318733434190706,1.8300852450867844,3305
12,"Agents and Managers for Artists, Athletes, Entertainers, and Other Public Figures",7.319284360189576,1.8038781277310871,211
678,Other Management Consulting Services,7.330170212765942,1.8056128182163937,1692
673,Other Individual and Family Services,7.333709401709396,1.9111777596829302,585
132,Building Inspection Services,7.336886889460151,1.654823448881132,389
802,"Process, Physical Distribution, and Logistics Consulting Services",7.3671746794871735,1.810840305796678,624
32,All Other Legal Services,7.415742296918762,1.7398168639024698,357
807,"Promoters of Performing Arts, Sports, and Similar Events without Facilities",7.431164948453604,1.8385111501450002,388
499,Marketing Consulting Services,7.440865808059823,1.7405292828319996,2407
991,Travel Agencies,7.440901442307688,1.8325225585548386,416
423,"Independent Artists, Writers, and Performers",7.445668604651161,1.7728729702788724,860
343,Footwear and Leather Goods Repair,7.459718309859157,1.9205274363577356,71
23,All Other Consumer Goods Rental,7.461565217391303,1.8444694912203659,115
845,Residential Remodelers,7.465988812845383,1.8846655474173235,7598
821,Recreational Goods Rental,7.564436781609196,1.8820912521506705,87
25,All Other General Merchandise Stores,7.585496183206105,1.6929292836975514,131
1026,Wireless Telecommunications Carriers (except Satellite),7.602,1.4700512321004324,65
60,All Other Support Activities for Transportation,7.609307531380744,1.8679989583991945,478
557,Musical Groups and Artists,7.878714285714286,1.6635477572951267,140
282,Electronic Shopping and Mail-Order Houses,8.749448000000102,1.8594409542405625,3375
