,desc,InitialInterestRate,InitialInterestRate,InitialInterestRate
42,All Other Miscellaneous Nonmetallic Mineral Product Manufacturing,6.466949152542374,1.9864569518385966,59
454,Iron and Steel Mills and Ferroalloy Manufacturing,6.467692307692308,1.2326117900773579,52
618,Ophthalmic Goods Manufacturing,6.469038461538461,1.3466185095476784,52
39,All Other Miscellaneous Food Manufacturing,6.469734806629832,1.4010077144290045,543
992,Travel Trailer and Camper Manufacturing,6.4708695652173915,1.5227623304670739,69
70,Ambulance Services,6.476314199395773,1.5691112166033663,331
659,Other Electronic and Precision Equipment Repair and Maintenance,6.476380846325167,1.4235031642571687,449
885,Service Establishment Equipment and Supplies Merchant Wholesalers,6.476741206030149,1.651454606777737,398
506,Meat Markets,6.480180412371129,1.426497251557009,776
449,Investment Advice,6.480655339805812,1.3468525408552043,2266
526,Metal Window and Door Manufacturing,6.480814814814814,1.5491625334362962,135
18,All Other Amusement and Recreation Industries,6.48209533898305,1.332771120225265,3304
292,Environmental Consulting Services,6.486351477449454,1.593009009683127,643
178,Commercial and Industrial Machinery and Equipment (except Automotive and Electronic) Repair and Maintenance,6.486361960213483,1.540239588911837,2061
46,All Other Miscellaneous Waste Management Services,6.489209677419353,1.3729910721555194,372
620,Optical Goods Stores,6.490864055299541,1.3745882028574186,434
301,Facilities Support Services,6.492270270270272,1.339280400728086,185
424,Industrial Building Construction,6.492296178343949,1.5575005038954235,628
855,"Rooming and Boarding Houses, Dormitories, and Workers' Camps",6.492327586206898,1.4645663436714376,58
975,Tire Dealers,6.492717391304347,1.4453448611529713,782
95,Automotive Exhaust System Repair,6.494088000000001,1.5662660859097244,125
727,"Paint, Varnish, and Supplies Merchant Wholesalers",6.494756097560975,1.3185665857330615,82
550,Motor Vehicle Transmission and Power Train Parts Manufacturing,6.497692307692309,1.440689670608661,52
655,Other Direct Selling Establishments,6.498616637579981,1.4698787973530774,1719
270,Drycleaning and Laundry Services (except Coin-Operated),6.499157037982792,1.4114283005584378,3133
262,Dried and Dehydrated Food Manufacturing,6.49969696969697,1.6650183364173683,66
361,Furniture Merchant Wholesalers,6.501447084233258,1.6620156713734164,463
658,Other Electronic Parts and Equipment Merchant Wholesalers,6.503867669172936,1.5786478822323347,665
377,Glass Product Manufacturing Made of Purchased Glass,6.504199999999997,1.5203135803347727,150
106,Beef Cattle Ranching and Farming,6.504929971988792,1.6984599131398357,357
786,Poured Concrete Foundation and Structure Contractors,6.504990865126263,1.5948843297196578,1861
575,Nonchocolate Confectionery Manufacturing,6.505779220779221,1.5661016521368274,77
929,Sports Teams and Clubs,6.5075507246376825,1.550123932283296,138
378,Glass and Glazing Contractors,6.50786461538461,1.4550709459541373,650
687,Other Motor Vehicle Parts Manufacturing,6.5091746031746025,1.5540139771796908,126
414,Household Appliance Stores,6.509783185840709,1.685600862700968,226
778,Portfolio Management,6.510311418685122,1.4972807203258307,289
979,Title Abstract and Settlement Offices,6.510500000000003,1.4856447992142383,230
290,Engineering Services,6.511665832638336,1.6158226874464416,3597
794,Prefabricated Wood Building Manufacturing,6.512571428571429,1.498651022129023,70
581,Nonresidential Property Managers,6.513373913043474,1.5175125829478757,460
393,Hardware Merchant Wholesalers,6.513716417910448,1.5471612967053758,335
350,Fresh Fruit and Vegetable Merchant Wholesalers,6.514538135593214,1.7041938299405832,472
812,Racetracks,6.514736842105263,1.7449090288026456,57
407,Home Furnishing Merchant Wholesalers,6.5172051282051235,1.555601096704585,507
196,Confectionery and Nut Stores,6.5234400000000035,1.438736134310639,375
894,Shoe Stores,6.528870165745855,1.488689264372636,724
803,Professional Employer Organizations,6.529519999999999,1.5790037978258271,125
954,Surveying and Mapping (except Geophysical) Services,6.530995061728394,1.5536332760375586,405
224,"Crop Harvesting, Primarily by Machine",6.531621621621621,1.3092913769146606,74
28,All Other Home Furnishings Stores,6.531750547045949,1.5370455718521867,914
502,Materials Recovery Facilities,6.534245283018866,1.4513456423721651,159
351,"Frozen Cakes, Pies, and Other Pastries Manufacturing",6.534927536231883,1.4836992948751295,69
353,Frozen Specialty Food Manufacturing,6.535856115107913,1.4935459195919372,139
871,Scheduled Passenger Air Transportation,6.5391379310344835,1.5940759678157044,58
264,Drinking Places (Alcoholic Beverages),6.540360397047628,1.3868533778556031,3929
190,Computer and Computer Peripheral Equipment and Software Merchant Wholesalers,6.540792056074763,1.672177563667576,428
202,Consumer Electronics and Appliances Rental,6.542545454545454,1.5268105141244783,187
946,Support Activities for Forestry,6.542639784946237,1.5153349801202927,186
779,Postal Service,6.543092783505154,1.3636710264520842,97
219,Court Reporting and Stenotype Services,6.545727272727273,1.5124341705235267,88
995,"Truck, Utility Trailer, and RV (Recreational Vehicle) Rental and Leasing",6.549589958158998,1.5559403973915176,239
59,All Other Specialty Trade Contractors,6.552377814845678,1.575328785683033,8393
667,Other Gasoline Stations,6.552726495726498,1.6590874275505603,234
559,Musical Instrument and Supplies Stores,6.552966789667891,1.5180041847751442,542
516,Men's and Boys' Clothing and Furnishings Merchant Wholesalers,6.554425324675325,1.604279981252985,308
373,Geophysical Surveying and Mapping Services,6.560168067226892,1.5877982747643156,119
558,Musical Instrument Manufacturing,6.561369863013698,1.5774569153021907,73
1006,Used Household and Office Goods Moving,6.562657929226733,1.5795383938637497,763
1011,Vocational Rehabilitation Services,6.562984042553192,1.3862506794472862,188
606,"Offices of Physical, Occupational and Speech Therapists, and Audiologists",6.563129892037785,1.5485484713773232,2964
648,Other Computer Related Services,6.5635678496868515,1.503245469283755,2874
365,General Automotive Repair,6.564637316811593,1.6137500464273222,8393
843,Residential Mental Health and Substance Abuse Facilities,6.56548888888889,1.4695216760392495,225
944,Support Activities for Animal Production,6.566468749999994,1.505985927634711,448
949,Support Activities for Oil and Gas Operations,6.567103296703294,1.5297629475793633,910
872,School and Employee Bus Transportation,6.568766393442623,1.7491754079436515,244
664,Other Food Crops Grown Under Cover,6.568857142857143,1.649801518898511,70
1015,Water Supply and Irrigation Systems,6.569251968503937,1.4611792815334714,254
358,Full-Service Restaurants,6.570692535628691,1.4817266566726561,21261
242,"Data Processing, Hosting, and Related Services",6.570906249999994,1.5697130711429057,960
330,Florists,6.573629889668999,1.5296416169595486,997
699,Other Residential Care Facilities,6.575313315926891,1.4662602573942474,383
961,Telemarketing Bureaus and Other Contact Centers,6.575952380952381,1.4576025199411677,84
1030,"Women's, Girls', and Infants' Cut and Sew Apparel Manufacturing",6.577290322580647,1.793717864883394,155
927,Sporting and Athletic Goods Manufacturing,6.58042824074074,1.5259712146599982,432
512,Medical Laboratories,6.581354729729727,1.5085691136766028,592
902,"Small Arms, Ordnance, and Ordnance Accessories Manufacturing",6.586827586206897,1.4736760795392918,116
970,Textile and Fabric Finishing Mills,6.587068965517241,1.462697590335866,58
36,All Other Miscellaneous Crop Farming,6.588192307692309,1.8104879463287242,260
215,Cosmetology and Barber Schools,6.588673611111109,1.3888254723868947,288
122,"Book, Periodical, and Newspaper Merchant Wholesalers",6.593373493975903,1.7366748976893955,83
306,Farm Management Services,6.593843137254902,1.5819096860762818,51
698,Other Professional Equipment and Supplies Merchant Wholesalers,6.594311111111111,1.4986120337758466,225
922,Specialty (except Psychiatric and Substance Abuse) Hospitals,6.599363636363637,1.5847894049092008,55
436,Industrial and Personal Service Paper Merchant Wholesalers,6.60022346368715,1.7745462959655387,179
1007,Used Merchandise Stores,6.606008537886875,1.4725453724278421,937
1003,Upholstered Household Furniture Manufacturing,6.606949152542373,1.814603395944118,118
323,Fitness and Recreational Sports Centers,6.60882753557714,1.3575026572064082,8854
567,New Housing For-Sale Builders,6.609593333333333,1.7559467822142787,150
514,Medicinal and Botanical Manufacturing,6.612905982905983,1.6218322226192092,117
209,Cookie and Cracker Manufacturing,6.613727272727274,1.6256176576840398,110
355,Fruit and Vegetable Canning,6.614783505154639,1.6243112529289927,97
442,Insurance Agencies and Brokerages,6.614907994806182,1.4661674997622465,5391
619,Ophthalmic Goods Merchant Wholesalers,6.616369863013699,1.6568161527698682,73
826,Refrigeration Equipment and Supplies Merchant Wholesalers,6.623766233766234,1.7995240883728991,77
966,Temporary Help Services,6.624186261558781,1.6075133384361573,757
735,Passenger Car Rental,6.624696132596685,2.248638981309081,181
553,"Motorcycle, Bicycle, and Parts Manufacturing",6.626027397260275,1.6806248753538093,146
789,Power and Communication Line and Related Structures Construction,6.630243298969071,1.6430941918611777,485
62,All Other Telecommunications,6.633154708520179,1.6112795713067183,446
44,All Other Miscellaneous Store Retailers (except Tobacco Stores),6.634861647186757,1.5067527252455564,3679
513,"Medical, Dental, and Hospital Equipment and Supplies Merchant Wholesalers",6.638505314799662,1.6614272781021162,1223
635,Other Building Equipment Contractors,6.638766978922715,1.6441277638621854,854
608,"Offices of Physicians, Mental Health Specialists",6.639532019704437,1.610084890336722,812
82,Architectural Services,6.639715423606072,1.6689310883476423,1381
584,Nonupholstered Wood Household Furniture Manufacturing,6.641219512195123,1.6288065421091973,246
549,Motor Vehicle Towing,6.643928571428564,1.6262322238876188,1120
743,Pet and Pet Supplies Stores,6.64577630415561,1.4406872543894236,1131
739,Periodical Publishers,6.649084415584416,1.442979075296419,308
691,Other Nonscheduled Air Transportation,6.651764705882353,1.4799091754871165,68
869,"Scenic and Sightseeing Transportation, Water",6.655604651162792,1.6626511193987987,215
236,Cut and Sew Apparel Contractors,6.6580208333333335,1.8523862156339397,144
93,Automobile and Other Motor Vehicle Merchant Wholesalers,6.658756410256408,1.7621365194082514,546
1020,Wholesale Trade Agents and Brokers,6.661995104039161,1.5941503138083366,817
834,Remediation Services,6.666055276381905,1.4767540106643422,597
742,Pet Care (except Veterinary) Services,6.669066526610634,1.427609427393878,2856
120,Book Publishers,6.669392523364488,1.4366357104189218,214
138,Cable and Other Subscription Programming,6.6703134328358225,1.5131419970715483,67
736,Payroll Services,6.670933333333336,1.5684632528024043,150
408,Home Health Care Services,6.671360000000002,1.462646156866805,3550
370,General Medical and Surgical Hospitals,6.672520467836257,1.6115453210001345,171
925,Spice and Extract Manufacturing,6.674478260869566,1.7539582848407875,69
971,Theater Companies and Dinner Theaters,6.675038759689922,1.6729026626789885,129
338,Food (Health) Supplement Stores,6.676381455399058,1.5278002138920963,852
410,Home and Garden Equipment Repair and Maintenance,6.677020408163265,1.578636479632883,245
50,All Other Outpatient Care Centers,6.680732638888884,1.6519812057181196,576
710,Other Support Activities for Road Transportation,6.68361931818182,1.761865880745185,352
504,"Mayonnaise, Dressing, and Other Prepared Sauce Manufacturing",6.688601941747572,1.5457815292189987,103
701,Other Services Related to Advertising,6.690323216995441,1.5386781640864486,659
29,All Other Information Services,6.691226912928757,1.5228895141092254,379
983,Tobacco and Tobacco Product Merchant Wholesalers,6.692320261437908,1.7592810308310711,153
633,Other Automotive Mechanical and Electrical Repair and Maintenance,6.694427662957071,1.6183069384600497,629
930,Sports and Recreation Instruction,6.696357177615558,1.4878370448313754,2055
709,Other Support Activities for Air Transportation,6.697308411214954,1.7349703027384415,214
960,Telecommunications Resellers,6.6989040404040425,1.6197846118279293,198
964,Teleproduction and Other Postproduction Services,6.699754901960783,1.7308181495248487,204
772,"Plumbing, Heating, and Air-Conditioning Contractors",6.701554532055961,1.6611041047998465,8142
545,Motor Vehicle Parts (Used) Merchant Wholesalers,6.70467213114754,1.6651573694901396,122
415,"Household Appliances, Electric Housewares, and Consumer Electronics Merchant Wholesalers",6.705214925373137,1.8720379865616676,335
590,Office Administrative Services,6.706234597156398,1.6276872228494228,422
641,Other Clothing Stores,6.706883322764739,1.627116809188347,1577
694,Other Personal Care Services,6.708600687103643,1.4732430386470814,3784
326,Flight Training,6.709834586466164,1.4675069571899053,133
592,Office Furniture (except Wood) Manufacturing,6.713620689655174,1.5722335194125676,58
652,Other Cut and Sew Apparel Manufacturing,6.714181818181819,1.6383296661780964,110
65,All Other Travel Arrangement and Reservation Services,6.71468794326241,1.7118235603954706,141
139,"Cafeterias, Grill Buffets, and Buffets",6.718736263736262,1.554734365296361,182
72,Amusement Arcades,6.719452954048136,1.5484940075158589,457
183,Communication Equipment Repair and Maintenance,6.720727272727274,1.6769591905506558,110
467,Landscape Architectural Services,6.72282954545453,1.6100107462151123,1232
1017,Welding and Soldering Equipment Manufacturing,6.725333333333332,1.6435945851509588,159
626,Other Activities Related to Real Estate,6.726410958904098,1.632253980742411,1095
115,Blind and Shade Manufacturing,6.726724137931035,1.3738464225452829,58
458,Jewelry Stores,6.727620433017578,1.7460924879129147,1478
732,Parking Lots and Garages,6.728238095238096,1.7422956757140051,105
258,Document Preparation Services,6.72842857142857,1.5450022800051029,140
469,Language Schools,6.733194444444444,1.6518822609109776,72
148,Caterers,6.734213849287161,1.5524972035667834,1964
266,Drugs and Druggists' Sundries Merchant Wholesalers,6.734611021069685,1.69629268058022,617
61,All Other Support Services,6.735139402560446,1.7720257567353679,703
535,Mortgage and Nonmortgage Loan Brokers,6.735878504672898,1.4974882394940892,214
468,Landscaping Services,6.737551900846093,1.7162182635510723,8391
168,Coffee and Tea Manufacturing,6.738394160583936,1.6607936246778812,411
886,Services for the Elderly and Persons with Disabilities,6.738975770925107,1.4684287019719529,908
246,Dental Laboratories,6.740924024640656,1.5866564763839892,487
596,Offices of All Other Miscellaneous Health Practitioners,6.741093106180651,1.5828437170823633,2524
375,"Gift, Novelty, and Souvenir Stores",6.741183776022967,1.5830292334147813,1393
670,Other Grocery and Related Products Merchant Wholesalers,6.742275208491274,1.7587942515675252,1319
1008,Vending Machine Operators,6.7431007751937955,1.4858430146322006,1032
48,All Other Nondepository Credit Intermediation,6.745053763440859,1.5000961010200198,93
515,Men's Clothing Stores,6.745617886178863,1.5946496319571126,369
145,Carpet and Upholstery Cleaning Services,6.746140410958898,1.580227496001564,876
489,Luggage and Leather Goods Stores,6.747857142857142,1.8316848131319934,70
34,All Other Miscellaneous Ambulatory Health Care Services,6.748809034907593,1.633973110552538,487
906,Soft Drink Manufacturing,6.749917355371901,1.632928604209713,121
881,Security Systems Services (except Locksmiths),6.750701634877384,1.600775035538683,734
27,All Other Health and Personal Care Stores,6.75132373271889,1.5710920026446744,868
460,"Jewelry, Watch, Precious Stone, and Precious Metal Merchant Wholesalers",6.754351701782815,1.683144928921572,617
195,Confectionery Merchant Wholesalers,6.75467391304348,1.8171044949438826,184
171,"Colleges, Universities, and Professional Schools",6.755,1.6773754682653672,66
636,Other Building Finishing Contractors,6.755165086887827,1.5550216552250486,1266
20,All Other Automotive Repair and Maintenance,6.755348739495791,1.61286607811435,1190
89,Audio and Video Equipment Manufacturing,6.7568926553672295,1.5902969115296521,177
695,Other Personal and Household Goods Repair and Maintenance,6.761379225061824,1.5392825119026192,1213
711,Other Support Activities for Water Transportation,6.763918918918919,1.5998465830279514,74
179,Commercial and Institutional Building Construction,6.769176714601816,1.7533274141819877,3616
137,Business to Business Electronic Markets,6.773076923076924,1.5718058243974706,208
601,Offices of Lawyers,6.773369058295966,1.6827810399378171,6690
102,Barber Shops,6.774041525423721,1.6575582906262436,1180
261,Drafting Services,6.774541666666664,1.6097506195286369,120
241,Dance Companies,6.775308056872038,1.5939931961620686,211
724,Packing and Crating,6.777214285714286,1.4564814544416897,140
904,Snack and Nonalcoholic Beverage Bars,6.782978064162349,1.482718837446089,3647
91,Automobile Driving Schools,6.785015873015875,1.6620889012637547,189
840,Research and Development in the Social Sciences and Humanities,6.789925531914894,1.5888035279130184,94
104,Beauty Salons,6.790203890404437,1.560778185567945,8431
10,Advertising Agencies,6.796411376811593,1.702082283397935,1380
1023,Wine and Distilled Alcoholic Beverage Merchant Wholesalers,6.796702334630348,1.7021432627869701,514
157,Children's and Infants' Clothing Stores,6.799026373626372,1.535028041245054,455
51,All Other Personal Services,6.799413179916351,1.5735158826999531,3824
459,Jewelry and Silverware Manufacturing,6.802576271186442,1.7711410026866699,118
78,Apparel Accessories and Other Apparel Manufacturing,6.803183279742766,1.7343833603023648,311
121,Book Stores,6.803550151975685,1.6243385590254478,329
404,"Hobby, Toy, and Game Stores",6.804863523573198,1.5327291191791257,806
846,Retail Bakeries,6.810614476789923,1.5690021833174175,1271
712,Other Technical and Trade Schools,6.811111111111114,1.5021235127708534,351
164,Clothing Accessories Stores,6.813848728246312,1.7207398184102645,747
249,Diet and Weight Reducing Centers,6.815142857142858,1.5020488331600745,210
278,Electrical Contractors and Other Wiring Installation Contractors,6.81656267878179,1.7276178366464126,5943
714,Other Vegetable (except Potato) and Melon Farming,6.817427184466019,1.6492090891230005,103
897,Siding Contractors,6.817662116040956,1.720773583155131,293
677,Other Lighting Equipment Manufacturing,6.8266233766233775,1.8469231956145271,77
366,"General Freight Trucking, Local",6.82891350238124,1.784383202458908,7769
602,Offices of Mental Health Practitioners (except Physicians),6.83575455333911,1.6336265652858997,1153
271,Drywall and Insulation Contractors,6.840635559131124,1.822240175601205,1243
719,Outpatient Mental Health and Substance Abuse Centers,6.8424000000000005,1.6762540247693836,325
625,Other Activities Related to Credit Intermediation,6.844177215189872,1.56570997051877,79
11,Advertising Material Distribution Services,6.852556818181816,1.7818108756973194,176
43,All Other Miscellaneous Schools and Instruction,6.855028446389488,1.569606673007391,1371
665,"Other Foundation, Structure, and Building Exterior Contractors",6.856615049073061,1.730005117464829,917
295,Executive Search Services,6.864731182795699,1.4528394921653685,93
853,Roofing Contractors,6.871140254003304,1.739378845814857,1811
189,Computer Training,6.878268907563023,1.6522774200595456,119
888,"Sewing, Needlework, and Piece Goods Stores",6.885674603174603,1.572880750104168,378
385,Graphic Design Services,6.887672743055544,1.6976166984716363,1152
214,"Cosmetics, Beauty Supplies, and Perfume Stores",6.890662595419838,1.6470603229113279,1310
96,Automotive Glass Replacement Shops,6.891296829971181,1.696086379584791,347
288,Employment Placement Agencies,6.892204979253106,1.665279096351707,1205
411,Horses and Other Equine Production,6.892340425531916,1.8670852596320564,94
809,Public Relations Agencies,6.893848797250863,1.8151237151215958,291
425,Industrial Design Services,6.893945578231292,1.778346375888124,147
302,Family Clothing Stores,6.896834532374096,1.7049397785181506,695
806,"Promoters of Performing Arts, Sports, and Similar Events with Facilities",6.897232142857145,1.5938561907297009,448
297,Exterminating and Pest Control Services,6.899561091340446,1.6567005269839872,843
161,Claims Adjusting,6.902421874999998,1.7798839854671547,128
867,"Scenic and Sightseeing Transportation, Land",6.905468749999998,1.8907332491623954,128
920,"Specialized Freight (except Used Goods) Trucking, Local",6.9062462159434785,1.7512812855921616,1982
191,Computer and Office Machine Repair and Maintenance,6.906712328767121,1.52570168794965,511
349,Freight Transportation Arrangement,6.910581272084801,1.7391311111249075,1132
679,Other Marine Fishing,6.910588235294117,1.6601643433885764,51
232,Custom Computer Programming Services,6.911445648807715,1.7255095434523193,3229
1022,Window Treatment Stores,6.913827586206896,1.3866339859534222,290
318,Finfish Fishing,6.916875,1.5988436312557917,112
294,Exam Preparation and Tutoring,6.917646536412076,1.4697390081457942,563
22,All Other Business Support Services,6.920452149791944,1.6977982550117852,721
123,Books Printing,6.9290987654321,1.5408350950453644,81
328,Flooring Contractors,6.9309499105545465,1.750936175401503,1677
56,All Other Publishers,6.932655367231638,1.6334504959131366,177
187,Computer Systems Design Services,6.932864684263303,1.7237251000824128,2993
201,Consumer Electronics Repair and Maintenance,6.933125000000004,1.5912024614388247,264
1027,Women's Clothing Stores,6.935750703432736,1.7147158227513093,1777
707,Other Specialized Design Services,6.936833887043185,1.6636023896341672,602
702,Other Services to Buildings and Dwellings,6.9390537037037,1.7005149011905079,1620
958,Tax Preparation Services,6.941501388888876,1.6318989731325055,1440
919,Special Needs Transportation,6.9514588859416415,1.8956682827783282,377
501,Masonry Contractors,6.9531471365638655,1.7984394936640322,1135
448,Investigation Services,6.954576576576577,1.7559728275325255,222
847,Reupholstery and Furniture Repair,6.956167400881057,1.7454570180733309,227
511,Media Representatives,6.958717948717949,1.5518844810469865,156
260,"Doll, Toy, and Game Manufacturing",6.965535714285715,1.808523283560781,112
808,Psychiatric and Substance Abuse Hospitals,6.979607843137256,1.698115379807054,51
321,Fish and Seafood Markets,6.979821989528795,1.721994895688449,191
984,Toilet Preparation Manufacturing,6.9800609756097565,1.8543110098935776,164
973,Tile and Terrazzo Contractors,6.982110939907546,1.8208738058101905,649
487,Locksmiths,6.982379421221865,1.5386842297238743,311
396,Hay Farming,6.984918032786884,1.7997774148959085,61
175,Commercial Photography,6.989989304812832,1.7557406310227555,374
982,Tobacco Stores,6.991189279731982,1.7829880741335122,597
367,"General Freight Trucking, Long-Distance, Less Than Truckload",6.994053784860556,1.8893343754695608,502
198,Construction Sand and Gravel Mining,6.995443037974682,1.7642686672041652,316
708,Other Spectator Sports,7.002079207920794,1.6362868433326008,101
84,Art Dealers,7.004948126801153,1.7102594123164472,347
624,Other Accounting Services,7.01702523474177,1.7492754379425615,1704
969,Textile Bag and Canvas Mills,7.0200000000000005,2.088099982869963,53
610,Offices of Real Estate Agents and Brokers,7.020743474347419,1.7877449008759607,2222
716,Other Waste Collection,7.021891891891892,1.722998496691956,333
915,Sound Recording Studios,7.0233442622950815,1.8571350133351532,183
700,Other Scientific and Technical Consulting Services,7.025434662998615,1.8299368695448492,1454
486,Local Messengers and Local Delivery,7.029925373134319,1.5431721165626036,536
63,All Other Transit and Ground Passenger Transportation,7.033625570776253,1.953529755286789,438
457,Janitorial Services,7.036869109947676,1.7083341512137658,3247
844,Residential Property Managers,7.04188586956521,1.6981583474459963,1104
218,Couriers and Express Delivery Services,7.057981798715194,1.568264642169309,934
347,Framing Contractors,7.067940446650114,1.8935475606923045,403
316,Fine Arts Schools,7.079344726562495,1.5971061933620407,1024
283,Electronics Stores,7.098794771241815,1.8644158345608148,765
921,"Specialized Freight (except Used Goods) Trucking, Long-Distance",7.104978152929483,1.9080510268837705,1007
805,Professional and Management Development Training,7.109569948186531,1.695792114350854,386
693,Other Performing Arts Companies,7.117676470588235,1.6317633610819915,102
30,All Other Insurance Related Activities,7.126666666666665,1.6350555962171704,246
686,Other Motion Picture and Video Industries,7.126929824561402,1.6239742179352956,114
443,Interior Design Services,7.127715695067256,1.7875404355385134,1115
611,Offices of Real Estate Appraisers,7.1348098859315625,1.6531371293086496,263
19,All Other Animal Production,7.138461538461536,1.9159534458951781,91
466,Land Subdivision,7.145283018867925,1.630767402852441,53
804,Professional Organizations,7.148076923076923,1.9257023556599475,52
319,Finish Carpentry Contractors,7.1556792207792075,1.7983382350812298,1540
880,Security Guards and Patrol Services,7.1696626297577835,1.770536817621289,578
304,Farm Labor Contractors and Crew Leaders,7.1707017543859655,1.9062396225938827,57
417,Human Resources Consulting Services,7.175988764044942,1.8263299886249873,445
206,Convention and Trade Show Organizers,7.176450216450219,1.9666054832778856,231
989,Translation and Interpretation Services,7.181590163934426,1.8512016267764144,183
273,Educational Support Services,7.188177704194262,1.6915240871613693,906
252,Direct Life Insurance Carriers,7.189146341463413,1.7855138633171015,82
757,"Photography Studios, Portrait",7.208253697383382,1.6879335921233833,879
482,Limousine Service,7.212842424242407,1.9238250605211653,825
